{"schemaVersion":"1.0","source":"FOREBET","sportDate":"2026-07-21","snapshot":{"status":"SUCCEEDED","contentHash":"aaaaaaaaaaaaaaaaaaaaaaaaaaaaaaaaaaaaaaaaaaaaaaaaaaaaaaaaaaaaaaaa","parserVersion":"forebet-ou25-es/1.0.0","evidencePath":"var/evidence/forebet/2026-07-21/aaaaaaaaaaaaaaaaaaaaaaaaaaaaaaaaaaaaaaaaaaaaaaaaaaaaaaaaaaaaaaaa.html"},"counts":{"rowsFound":1,"valid":1,"rejected":0,"duplicates":0,"warnings":0},"observations":[{"sourceRowKey":"bbbbbbbbbbbbbbbbbbbbbbbbbbbbbbbbbbbbbbbbbbbbbbbbbbbbbbbbbbbbbbbb","homeTeamRaw":"Local","awayTeamRaw":"Visitante","suggestedSide":"OVER","probabilityUnder25":"42","probabilityOver25":"58","predictedHomeGoals":1,"predictedAwayGoals":3,"averageGoals":"2.92","sourceOdds":"1.57","warnings":[]}],"rejections":[],"warnings":[]}
